{
  "id": "alpine-2026-home",
  "clubId": "alpine",
  "season": "2026",
  "kitType": "home",
  "periodLabel": "2026",
  "periodFrom": "2026",
  "periodTo": "2026",
  "photos": {},
  "sponsors": [
    {
      "sponsorId": "bwt",
      "placement": "front",
      "source": {
        "name": "BWT Alpine Formula One Team – Partners (title partner and partner tiers)",
        "date": "2026-09-24",
        "url": "https://www.alpinef1.com/partners"
      }
    },
    {
      "sponsorId": "eni",
      "placement": "front",
      "source": {
        "name": "Eni – Eni, Renault Group and BWT Alpine Formula One Team new strategic partnership (PDF)",
        "date": "2025-02-13",
        "url": "https://www.eni.com/content/dam/enicom/documents/press-release/migrated/2025-en/02/pr-eni-renault-group-bwt-alpine-formula-one-team-new-strategic-partnership.pdf"
      }
    },
    {
      "sponsorId": "qatar-airways",
      "placement": "partner",
      "source": {
        "name": "Qatar Airways – Qatar Airways and BWT Alpine Formula One Team unite with Carmen Jordá",
        "date": "2026",
        "url": "https://www.qatarairways.com/press-releases/en-WW/258365-qatar-airways-and-bwt-alpine-formula-one-team-unite-with-carmen-jorda-to-champion-female-empowerment-in-motorsport-and-aviation/",
        "note": "date precision: year"
      }
    },
    {
      "sponsorId": "msc-cruises",
      "placement": "partner",
      "source": {
        "name": "BWT Alpine Formula One Team – Partners (title partner and partner tiers)",
        "date": "2026-09-24",
        "url": "https://www.alpinef1.com/partners"
      }
    },
    {
      "sponsorId": "etoro",
      "placement": "partner",
      "source": {
        "name": "BWT Alpine Formula One Team – Partners (title partner and partner tiers)",
        "date": "2026-09-24",
        "url": "https://www.alpinef1.com/partners"
      }
    },
    {
      "sponsorId": "boeing",
      "placement": "partner",
      "source": {
        "name": "BWT Alpine Formula One Team – Partners (title partner and partner tiers)",
        "date": "2026-09-24",
        "url": "https://www.alpinef1.com/partners"
      }
    }
  ],
  "sponsorsComplete": false,
  "change": null,
  "summary": "2026 car. S"
}
