{
  "id": "toronto-blue-jays-2026-27-home",
  "clubId": "toronto-blue-jays",
  "season": "2026-27",
  "kitType": "home",
  "periodLabel": "2026/27",
  "periodFrom": "2026-27",
  "periodTo": "2026-27",
  "photos": {},
  "sponsors": [
    {
      "sponsorId": "td-bank",
      "placement": "patch",
      "source": {
        "name": "Blinkfire Analytics (2026 MLB jersey patch list)",
        "date": "2026-04-20",
        "url": "https://analyticsblog.blinkfire.com/blog/2026/04/20/mlb-2026-jersey-patches-brands-buying-into-baseball"
      }
    }
  ],
  "sponsorsComplete": true,
  "summary": "Jersey patch: TD Bank.",
  "change": null
}
