{
  "id": "minnesota-vikings-2026-27-home",
  "clubId": "minnesota-vikings",
  "season": "2026-27",
  "kitType": "home",
  "periodLabel": "2026/27",
  "periodFrom": "2026-27",
  "periodTo": "2026-27",
  "photos": {},
  "sponsors": [],
  "sponsorsComplete": false,
  "summary": "No patch partner for 2026-27.",
  "change": null
}
