{
  "id": "alpecin-premier-tech-2026-home",
  "clubId": "alpecin-premier-tech",
  "season": "2026",
  "kitType": "home",
  "periodLabel": "2026 season",
  "periodFrom": "2026",
  "periodTo": "2026",
  "photos": {},
  "sponsors": [
    {
      "sponsorId": "alpecin",
      "placement": "front",
      "source": {
        "name": "Cyclist — Who actually are the 2026 Tour de France team sponsors? (Will Strickson / Ewan Wilson)",
        "date": "2026-07-14",
        "url": "https://www.cyclist.co.uk/in-depth/pro-cycling-sponsors"
      }
    },
    {
      "sponsorId": "premier-tech",
      "placement": "front",
      "source": {
        "name": "Cyclist — Who actually are the 2026 Tour de France team sponsors? (Will Strickson / Ewan Wilson)",
        "date": "2026-07-14",
        "url": "https://www.cyclist.co.uk/in-depth/pro-cycling-sponsors"
      }
    }
  ],
  "sponsorsComplete": false,
  "summary": "2026 UCI WorldTeam. Alpecin-Premier Tech's name and jersey carry its title sponsor(s); full kit placements not yet all checked.",
  "change": null
}
