{
  "id": "uae-team-emirates-xrg-2026-home",
  "clubId": "uae-team-emirates-xrg",
  "season": "2026",
  "kitType": "home",
  "periodLabel": "2026 season",
  "periodFrom": "2026",
  "periodTo": "2026",
  "photos": {},
  "sponsors": [
    {
      "sponsorId": "emirates",
      "placement": "front",
      "source": {
        "name": "Cyclist — Who actually are the 2026 Tour de France team sponsors? (Will Strickson / Ewan Wilson)",
        "date": "2026-07-14",
        "url": "https://www.cyclist.co.uk/in-depth/pro-cycling-sponsors"
      }
    },
    {
      "sponsorId": "xrg",
      "placement": "front",
      "source": {
        "name": "UAE Team Emirates — XRG Named as Co-title Partner and Official Energy Partner",
        "date": "2024-12-17",
        "url": "https://www.uaeteamemirates.com/xrg-named-co-title-partner-official-energy-partner-uae-team-emirates/"
      }
    },
    {
      "sponsorId": "g42",
      "placement": "partner",
      "source": {
        "name": "The Inner Ring — Pro Team Sponsors Explained",
        "date": "2026-07-10",
        "url": "https://inrng.com/2026/07/pro-team-sponsors-2026/"
      }
    },
    {
      "sponsorId": "colnago",
      "placement": "partner",
      "source": {
        "name": "The Inner Ring — Pro Team Sponsors Explained",
        "date": "2026-07-10",
        "url": "https://inrng.com/2026/07/pro-team-sponsors-2026/"
      }
    }
  ],
  "sponsorsComplete": false,
  "summary": "2026 UCI WorldTeam. UAE Team Emirates XRG's name and jersey carry its title sponsor(s); full kit placements not yet all checked.",
  "change": null
}
